{
  "active_after": {
    "database_sha256": "ff4bc58e3a77585dccb8b22bd049b50612b0a8c85f7fb858551ea424021fbdc0",
    "release_id": "lawrel_1bee97015ee440c71ea993b083a89005",
    "verified": true
  },
  "catalog": {
    "catalog_id": "deeplaw-cn-official",
    "catalog_version": "2026.07.16.2",
    "document_count": 28,
    "sequence": 2,
    "sha256": "49cf75169726e18851897556617fad4132881614c3f6ab9c6b2a78d4f8524305",
    "signature_key_id": "ed25519:0e3f95bd070fa3b48f84670b18805947f4f3f553fe60346d8abc6b76dcfd84eb",
    "signature_sha256": "2a653b19966e8d3615dbde9b6e3c9356a67f192a367c41a0b356387988f302f6",
    "signature_verified": true
  },
  "competitive_claim_eligible": false,
  "decision_summary": {
    "blocked_invalid_evidence": 0,
    "ingest_new_source_revision": 0,
    "no_action": 13,
    "rebuild_derived": 0,
    "recompile_knowledge": 0,
    "reparse_source_ir": 15
  },
  "limitations": [
    "These 28 identities belong to the isolated Authoritative Pack, not the general Living Wiki source plane.",
    "No title, original text, source path, private path, or private payload is recorded.",
    "Agent-derived legal interpretation is outside this matrix and remains legal_authority=false.",
    "Review-required extraction risk remains explicit and is not converted into Authority."
  ],
  "record_sha256": "a81913e1d2f1b82dff08986db8834c67d476037a79cf8a5eb2df57d55f508abf",
  "release_target": "0.11.0",
  "reproducibility": {
    "build_report_byte_identical": true,
    "build_report_sha256": "549d677c41ec6e3aa3920462fa870d7fd1af9e5f2ba278422ca72503e2f88d90",
    "database_byte_identical": true,
    "database_sha256": "ff4bc58e3a77585dccb8b22bd049b50612b0a8c85f7fb858551ea424021fbdc0",
    "isolated_build_count": 2
  },
  "retrieval_quality": {
    "baseline": {
      "average_excerpt_chars": 230.541,
      "average_serialized_response_chars": 5972.162,
      "blocking_gap_case_count": 25,
      "blocking_gap_count": 83,
      "case_count": 37,
      "cases_sha256": "87ba0abd1bee8a75b870d5dc0125bca249a1dea84b896d8d46f217e58ed9be54",
      "constraint_pass_rate": 1.0,
      "covered_required_duty_count": 68,
      "database_sha256": "b6124bdc77888c0cf4600f3c0dca7ae899ba09cbf92b33b3a52809e40fa231c8",
      "hit_at_1": 0.9705882352941176,
      "mrr": 0.9852941176470589,
      "overall_pass_rate": 1.0,
      "p50_latency_ms": 19.387,
      "p95_latency_ms": 33.506,
      "ranked_case_count": 34,
      "receipt_verification_pass_rate": 1.0,
      "release_id": "lawrel_a77f33377a74be235da19900636dd3a3",
      "required_duty_count": 138,
      "required_duty_covered_rate": 0.4927536231884058,
      "retrieval_pass_rate": 1.0,
      "source_manifest_sha256": "49cf75169726e18851897556617fad4132881614c3f6ab9c6b2a78d4f8524305",
      "uncertain_required_duty_count": 26
    },
    "competitive_claim_eligible": false,
    "frozen_cases": true,
    "quality_regression": false,
    "target": {
      "average_excerpt_chars": 230.541,
      "average_serialized_response_chars": 5985.676,
      "blocking_gap_case_count": 25,
      "blocking_gap_count": 83,
      "case_count": 37,
      "cases_sha256": "87ba0abd1bee8a75b870d5dc0125bca249a1dea84b896d8d46f217e58ed9be54",
      "constraint_pass_rate": 1.0,
      "covered_required_duty_count": 68,
      "database_sha256": "ff4bc58e3a77585dccb8b22bd049b50612b0a8c85f7fb858551ea424021fbdc0",
      "hit_at_1": 0.9705882352941176,
      "mrr": 0.9852941176470589,
      "overall_pass_rate": 1.0,
      "p50_latency_ms": 18.553,
      "p95_latency_ms": 31.534,
      "ranked_case_count": 34,
      "receipt_verification_pass_rate": 1.0,
      "release_id": "lawrel_1bee97015ee440c71ea993b083a89005",
      "required_duty_count": 138,
      "required_duty_covered_rate": 0.4927536231884058,
      "retrieval_pass_rate": 1.0,
      "source_manifest_sha256": "49cf75169726e18851897556617fad4132881614c3f6ab9c6b2a78d4f8524305",
      "uncertain_required_duty_count": 26
    }
  },
  "schema_version": "deeplaw.authoritative-source-quality-decision-matrix/v1",
  "snapshot": {
    "active_database_sha256": "b6124bdc77888c0cf4600f3c0dca7ae899ba09cbf92b33b3a52809e40fa231c8",
    "active_release_id": "lawrel_a77f33377a74be235da19900636dd3a3",
    "archive_sha256": "6ce04e7268ddf73d005c8fb72238cc0891e273c5d370c8e6bd4c1ab3a717757d",
    "restore_inventory_verified": true
  },
  "sources": [
    {
      "authoritative_pack": {
        "catalog_id": "deeplaw-cn-official",
        "catalog_sequence": 2,
        "catalog_sha256": "49cf75169726e18851897556617fad4132881614c3f6ab9c6b2a78d4f8524305",
        "signature_verified": true,
        "target_database_sha256": "ff4bc58e3a77585dccb8b22bd049b50612b0a8c85f7fb858551ea424021fbdc0",
        "target_release_id": "lawrel_1bee97015ee440c71ea993b083a89005"
      },
      "authority": "official",
      "byte_size": 269856,
      "compilation": {
        "compilation_run_id": null,
        "compiler_profile": null,
        "status": "not_applicable_authoritative_pack"
      },
      "decision": "no_action",
      "derived_state": {
        "canvas": "not_applicable",
        "dense": "not_enabled",
        "fts": "ready",
        "graph": "pack_level_relations_ready",
        "wiki_source_page": "not_applicable"
      },
      "execution_status": "verified",
      "extraction_quality": {
        "before_blocks": 1038,
        "before_characters": 19275,
        "coverage_ratio": 1.0,
        "needs_ocr": false,
        "pages": 46,
        "review_required": false,
        "review_required_segments": 0,
        "skipped_fragment_count": 0,
        "target_blocks": 1038,
        "target_characters": 19275,
        "warning_count": 0
      },
      "format": "PDF",
      "fragments": {
        "count": 88,
        "inventory_sha256": "9ef19ca126ccd2eafc81b38aa8d4fead4836907b332883194aedc5884d065600",
        "kind": "authoritative_segment",
        "locator_complete": true,
        "order_stable": true,
        "stable_ids": true
      },
      "immutable_bytes_sha256": "7e99645e83429ef4e073dec77ff4e2ce31558a41c13c1910fafbf8f22dc64afb",
      "knowledge_output": {
        "knowledge_revision_count": 0,
        "synthesis_freshness": "not_applicable_authoritative_pack"
      },
      "lifecycle": "active",
      "media_type": "application/pdf",
      "origin": "official",
      "parser": {
        "before_configuration_sha256": "5c9ade81de79e52912fa932ba58ea662d79706b9dcf3a0253957df2aa73893ef",
        "before_identity": "deeplaw-vision-consensus",
        "before_version": "deeplaw-vision-consensus/v2",
        "target_configuration_sha256": "5c9ade81de79e52912fa932ba58ea662d79706b9dcf3a0253957df2aa73893ef",
        "target_identity": "deeplaw-vision-consensus",
        "target_version": "deeplaw-vision-consensus/v2"
      },
      "reason_codes": [
        "immutable_source_bytes_verified",
        "current_extraction_byte_equivalent"
      ],
      "rollback": {
        "previous_active_release_id": "lawrel_a77f33377a74be235da19900636dd3a3",
        "restore_inventory_verified": true,
        "snapshot_sha256": "6ce04e7268ddf73d005c8fb72238cc0891e273c5d370c8e6bd4c1ab3a717757d"
      },
      "scope": "law_support_official",
      "sensitivity": "public",
      "source_ir": {
        "before_digest": "0bfd08c28abf7610167ade94ef2074eed8d670a558c396f7230558112c9f0b93",
        "compilation_id": null,
        "compilation_semantics": "Not applicable to the isolated Authoritative Pack extraction pipeline; release and build-report identities govern extraction.",
        "target_digest": "0bfd08c28abf7610167ade94ef2074eed8d670a558c396f7230558112c9f0b93"
      },
      "source_revision_id": null,
      "source_revision_semantics": "Authoritative Pack uses document_id plus exact signed-catalog source_sha256; it does not mint general Knowledge OS Source Revisions.",
      "stable_source_id": "doc_0036f31247cbc26f88253cc1"
    },
    {
      "authoritative_pack": {
        "catalog_id": "deeplaw-cn-official",
        "catalog_sequence": 2,
        "catalog_sha256": "49cf75169726e18851897556617fad4132881614c3f6ab9c6b2a78d4f8524305",
        "signature_verified": true,
        "target_database_sha256": "ff4bc58e3a77585dccb8b22bd049b50612b0a8c85f7fb858551ea424021fbdc0",
        "target_release_id": "lawrel_1bee97015ee440c71ea993b083a89005"
      },
      "authority": "official",
      "byte_size": 264585,
      "compilation": {
        "compilation_run_id": null,
        "compiler_profile": null,
        "status": "not_applicable_authoritative_pack"
      },
      "decision": "reparse_source_ir",
      "derived_state": {
        "canvas": "not_applicable",
        "dense": "not_enabled",
        "fts": "ready",
        "graph": "pack_level_relations_ready",
        "wiki_source_page": "not_applicable"
      },
      "execution_status": "verified",
      "extraction_quality": {
        "before_blocks": 387,
        "before_characters": 6992,
        "coverage_ratio": 1.0,
        "needs_ocr": true,
        "pages": 22,
        "review_required": true,
        "review_required_segments": 1,
        "skipped_fragment_count": 0,
        "target_blocks": 392,
        "target_characters": 6967,
        "warning_count": 8
      },
      "format": "PDF",
      "fragments": {
        "count": 45,
        "inventory_sha256": "36047498b925cfdb1417b1907d4a2eb099c6c42c4dbb329ffdefc6fe8edbe7dd",
        "kind": "authoritative_segment",
        "locator_complete": true,
        "order_stable": true,
        "stable_ids": true
      },
      "immutable_bytes_sha256": "d7b9322aff9da739f5167ad0befb34ad5cc4b47ebee6ff658bbccb0656bba5ce",
      "knowledge_output": {
        "knowledge_revision_count": 0,
        "synthesis_freshness": "not_applicable_authoritative_pack"
      },
      "lifecycle": "active",
      "media_type": "application/pdf",
      "origin": "official",
      "parser": {
        "before_configuration_sha256": "b5f681597e4441fbc23562034c465ff24e91a58c0eaee41e99f0dc316afaefac",